ORCID,Hopkins Profile,Year,Title,Authors,PubMed Link,Abstract
0000-0001-9729-2756,https://profiles.hopkinsmedicine.org/provider/linda-chu/2708877,2018,Cinematic rendering of small bowel pathology: preliminary observations from this novel 3D CT visualization method,"Rowe Steven P, Chu Linda C, Fishman Elliot K",https://pubmed.ncbi.nlm.nih.gov/29589059/,"3D visualization methods for volumetric CT data have played an important role in diagnostic imaging of the small bowel, a structure which intrinsically crosses numerous slices in any 2D imaging plane. Recently, a new approach to 3D CT image creation has become available-cinematic rendering (CR). CR differs from other 3D methods in making use of a global lighting model that produces high surface detail and realistic shadowing effects that lead to 3D visualizations with photorealistic quality. Although the utility of these images for improving diagnostic accuracy has not yet been established, our group's early experience in regions of complex anatomy and pathology has been encouraging. In this pictorial review, we review the established role of 3D CT in many of the most common small bowel pathologies, provide examples of those pathologies visualized with CR, and suggest future directions for researchers to pursue."
0000-0001-9729-2756,https://profiles.hopkinsmedicine.org/provider/linda-chu/2708877,2018,Evaluation of Stomach Neoplasms with 3-Dimensional Computed Tomography: Focus on the Potential Role of Cinematic Rendering,"Rowe Steven P, Chu Linda C, Fishman Elliot K",https://pubmed.ncbi.nlm.nih.gov/29787502/,"Evaluation of stomach neoplasms by traditional 3-dimensional (3D) computed tomography methods such as volume rendering and maximum-intensity projection plays an important role in lesion detection and characterization, preoperative planning, staging, and follow-up. Recently, a new 3D visualization method has become available known as cinematic rendering (CR). This novel technique makes use of a complex global lighting model to impart photorealistic levels of detail to 3D images. Although this new technique has yet to be systematically studied for the evaluation of stomach neoplasms, its intrinsic ability to create realistic shadowing effects to enhance understanding of the 3D relative locations of anatomic structures and to enhance detail and texture may prove valuable for a variety of applications. In this article, we demonstrate the CR appearance of multiple different gastric neoplasms, describe potential advantages of CR, and suggest future research directions."
0000-0001-9729-2756,https://profiles.hopkinsmedicine.org/provider/linda-chu/2708877,2018,Gastric neuroendocrine tumors in MEN1 syndrome: Cinematic rendering,"Chu Linda C, Fishman Elliot K",https://pubmed.ncbi.nlm.nih.gov/29782244/,Abstract unavailable.
0000-0001-9729-2756,https://profiles.hopkinsmedicine.org/provider/linda-chu/2708877,2018,Management of pancreatic intraductal papillary mucinous neoplasm,"Hoshi Hisakazu, Zaheer Atif, El Abiad Rami G, Maxwell Jessica E, Chu Linda C, Gerke Henning, Chan Carlos H",https://pubmed.ncbi.nlm.nih.gov/29753366/,Abstract unavailable.
0000-0001-9729-2756,https://profiles.hopkinsmedicine.org/provider/linda-chu/2708877,2018,The Use of Low-Dose CT Intra- and Extra-Nodular Image Texture Features to Improve Small Lung Nodule Diagnosis in Lung Cancer Screening,"Rongkai Yan, Saeed Ashrafinia, Seyoun Park, Junghoon Lee, Linda C. Chu, Cheng Ting Lin, Amira Hussien, Nagina Malguria, Jon A. Steingrimsson, Arman Rahmim, Peng Huang",N/A,"–Standard computed tomography (CT) scan is performed on lung cancer patients for progression and lesion classification. However, low-dose CT (LDCT) is commonly used in lung cancer screening for high-risk people. Extensive studies have shown that computer-aided diagnosis (CAD) using standard CT could greatly improve the diagnostic accuracy of early lung cancer. Unlike standard CT imaging, the application of radiological texture features extracted by radiologists on LDCT imaging is not well established due to lower resolution and higher variations. The purpose of this study is to investigate possible diagnosis value of texture features by comparing the classification performance of radiologic reading with radiologic reading combined with computer-aided texture features. A total of 186 biopsy-confirmed control and lung cancer cases were obtained from the National Lung Screening Trial (NLST). Cases were matched by various clinical parameters including age, gender, smoking status, chronic obstructive pulmonary disease (COPD) status, body mass index (BMI) and image appearances. We compared the subjective diagnosis of benign/malignant with the consensus readings of three radiologists. We then developed a CAD framework that imports radiologic reading features and extracts CAD features for heterogeneity quantification and data analysis. A total of 1342 CAD features were extracted. After eliminating highly correlated and redundant features, the remaining 458 features were given to a random forest algorithm, and a predicted probability of malignancy score (Pm) was calculated. Patients were grouped into 140 training (70 biopsypositive for cancer and 70 negatives) and 46 testing (20 positives and 26 negatives) sets, and a threshold value over Pm (0.5) was then used to classify the test set into cancer and non-cancer. Clinical accuracy [sensitivity, specificity, positive predictive value (PPV), and negative predictive value (PV)] were [0.95, 0.88, 0.86, 0.96] and [0.70, 0.69, 0.64, 0.75] for the CAD and radiologic reading, respectively. The CAD framework incorporating the clinical reading with the texture features extracted from LDCT increased the PPV and reduced the false positive (FP) rate in the early diagnosis of lung cancer. This approach shows promise for improving the accuracy of lung cancer diagnosis in the clinical environment, especially in patients with well-established risk factors."
0000-0001-9729-2756,https://profiles.hopkinsmedicine.org/provider/linda-chu/2708877,2018,Validation of contrast-enhanced time-resolved magnetic resonance angiography in pre-ablation planning in patients with atrial fibrillation: comparison with traditional technique,"Zghaib Tarek, Shahid Adeel, Pozzessere Chiara, Porter Kristin K, Chu Linda C, Eng John, Calkins Hugh, Kamel Ihab R, Nazarian Saman, Zimmerman Stefan L",https://pubmed.ncbi.nlm.nih.gov/29663178/,"Bolus timing is critical to optimal magnetic resonance angiography (MRA) acquisitions but can be challenging in some patients. Our purpose was to evaluate whether contrast-enhanced time-resolved magnetic resonance angiography (TR-MRA), a dynamic multiphase sequence that does not rely on bolus timing, is a viable alternative method to conventional 3D fast-long angle shot contrast-enhanced magnetic resonance angiography (CE-MRA). Coronal subtracted conventional CE-MRA images in 50 consecutive patients presenting for pre-atrial fibrillation ablation pulmonary venous (PV) mapping were compared with 50 TR-MRA images performed in 50 subsequent patients. The TR-MRA protocol was modified to optimize spatial resolution with slightly reduced temporal resolution (6.1 s scan time). Three experienced readers evaluated each scan's image quality and relative left atrial (LA) opacification based on a 4-point scale and diagnostic PV visualization in a binary fashion. Additionally, LA signal-to-noise ratio (SNR), contrast-to-noise ratio (CNR), and PV dimensions were measured for both techniques. TR-MRA had significantly higher overall image quality (3.10 ± 0.69 vs. 2.42 ± 0.69, p < 0.0001), and LA opacification scores (3.33 ± 0.70 vs. 2.15 ± 1.13, p < 0.0001) compared to CE-MRA. The proportion of diagnostically visualized pulmonary veins was 137/150 (91%) in the CE-MRA group vs. 147/150 (98%) with TR-MRA (p = 0.010). Both SNR and CNR were higher with TR-MRA vs. CE-MRA (277.9 ± 48.9 vs. 106.8 ± 41, p = 0.002 and 100.3 ± 41.7 vs. 70.7 ± 48.0, p = 0.002, respectively). Inter-reader variance of individual PV measurements for each of the MR techniques ranged between 0.62 and 1.47 mm and the ICC for vein measurements was higher with TR-MRA (range: 0.62-0.81) compared to CE-MRA (range: 0.47-0.64). TR-MRA, modified to maximize spatial resolution, offers an alternative method for performing high quality MRA examinations in patients with AF. TR-MRA offers greater overall image quality, PV visualization, and similarly reproducible PV measurements compared to traditional CE-MRA, without the challenges of proper bolus timing."
0000-0001-9729-2756,https://profiles.hopkinsmedicine.org/provider/linda-chu/2708877,2017,The many faces of pancreatic serous cystadenoma: Radiologic and pathologic correlation,"Chu L C, Singhi A D, Haroun R R, Hruban R H, Fishman E K",https://pubmed.ncbi.nlm.nih.gov/27614585/,"Pancreatic serous cystadenoma can be categorized into microcystic, honeycomb, oligocystic, and solid patterns based on imaging appearance. The presence of typical computed tomography (CT) features helps to differentiate serous cystadenomas from other cystic and solid pancreatic masses. Cases with atypical features present a diagnostic challenge as they can mimic malignant neoplasms. This article reviews pathophysiology, prevalence, CT features, mimickers and recommendations for management of pancreatic serous cystadenoma."
0000-0001-9729-2756,https://profiles.hopkinsmedicine.org/provider/linda-chu/2708877,2017,An Unusual Case of Penile Prostate Cancer Uncovered by Multiparametric MRI and PSMA-Targeted 18F-DCFPyL PET/CT,"Rowe Steven P, Gorin Michael A, Chu Linda C, Pienta Kenneth J, Pomper Martin G, Ross Ashley E, Macura Katarzyna J",https://pubmed.ncbi.nlm.nih.gov/28806262/,"Multiparametric MRI (mpMRI) is currently the test of choice for imaging sites of prostate cancer located within the pelvis. However, molecular imaging with PET radiotracers that bind to prostate-specific membrane antigen is increasingly being used for this purpose and may compliment mpMRI findings. We present a case of a 59-year-old man with elevated postprostatectomy serum prostate-specific antigen level who was found on both mpMRI and prostate-specific membrane antigen-targeted PET to harbor residual prostate cancer in the corpus spongiosum along the proximal urethra."
0000-0001-9729-2756,https://profiles.hopkinsmedicine.org/provider/linda-chu/2708877,2017,Diagnosis and detection of pancreatic cancer,"Chu Linda C, Goggins Michael G, Fishman Elliot K",https://pubmed.ncbi.nlm.nih.gov/29189329/,"Computed tomography is the first-line imaging modality for suspected pancreatic cancer. Magnetic resonance cholangiopancreatography is a second-line modality for suspected pancreatic cancer and is usually reserved for equivocal cases. Both computed tomography and MR are highly sensitive in the detection of pancreatic cancer, with up to 96% and 93.5% sensitivity, respectively. Computed tomography is superior to MR in the assessment of tumor resectability, with accuracy rates of up to 86.8% and 78.9%, respectively. Close attention to secondary signs of pancreatic cancer, such as pancreatic duct dilatation, abrupt pancreatic duct caliber change, and parenchymal atrophy, are critical in the diagnosis of pancreatic cancer. Emerging techniques such as radiomics and molecular imaging have the potential of identifying malignant precursors and lead to earlier disease diagnosis. The results of these promising techniques need to be validated in larger clinical studies."
0000-0001-9729-2756,https://profiles.hopkinsmedicine.org/provider/linda-chu/2708877,2017,Do early postoperative CT findings following type A aortic dissection repair predict early clinical outcome?,"Chu Linda C, Price Joel, Young Allen, Cameron Duke E, Fishman Elliot K",https://pubmed.ncbi.nlm.nih.gov/27864636/,"The purposes of this study are to determine the prevalence of specific postoperative CT findings following Stanford type A aortic dissection repair in the early postoperative period and to determine if these postoperative findings are predictive of adverse clinical outcome. Patients who underwent type A dissection repair between January 2012 and December 2014 were identified from our institutional cardiac surgery database. Postoperative CT exams within 1 month of surgery were retrospectively reviewed to determine sizes and attenuation of mediastinal, pericardial, and pleural fluid, and the presence or absence of pneumomediastinum, pneumothorax, or lung consolidation. Poor early clinical outcome was defined as length of stay (LOS) > 14 days. Student's t test and chi-square test were used to determine the relationship between postoperative CT features and early clinical outcome. Thirty-nine patients (24 M, 15 F, mean age 58.5 ± 13.7 years) underwent type A dissection repair and mean LOS was 17.3 ± 21.2 days. A subset of 19 patients underwent postoperative CTs within 30 days of surgery, and there was no significant relationship between LOS and sizes and attenuation of mediastinal, pericardial, and pleural fluid, and the presence or absence of pneumomediastinum, pneumothorax, or lung consolidation. CT features such as mediastinal, pericardial, and pleural fluid were ubiquitous in the early postoperative period. There was no consistent CT feature or threshold that could reliably differentiate between ""normal postoperative findings"" and early postoperative complications."
0000-0001-9729-2756,https://profiles.hopkinsmedicine.org/provider/linda-chu/2708877,2017,Evaluation of Coronary Artery Disease and Coronary Anomalies with a Handheld Smartphone,"Lin Cheng Ting, Zimmerman Stefan Loy, Chu Linda C, Eng John, Fishman Elliot K",https://pubmed.ncbi.nlm.nih.gov/28560509/,"The purpose of this study was to determine the diagnostic accuracy of an iPhone for evaluation of the coronary arteries on coronary CT angiography (CTA) in comparison to a standard clinical workstation. Fifty coronary CTA exams were selected to include a range of normal and abnormal cases including both coronary artery disease (CAD) of varying severity and coronary artery anomalies. Two cardiac radiologists reviewed each exam on a standard clinical workstation initially and then on an iPhone 6 after a washout period. Coronary stenosis was evaluated on a 4-point scale and presence of coronary anomalies was recorded. Two additional cardiac radiologists reviewed all cases in consensus on the standard workstation and these results were used as the reference standard. When reader results were compared to the reference standard, there was no significant difference in agreement for per-vessel stenosis scores using either the iPhone or standard clinical workstation. The intraobserver intertechnology agreement on a per-vessel basis for obstructive CAD were 97.4% (299/307, kappa = 0.777) and 97.5% (317/325, kappa = 0.804) for the two readers. All cases of coronary anomalies were identified by both readers regardless of the device used. Coronary CTA examinations can be interpreted on a smartphone with diagnostic accuracy comparable to a standard workstation. 3D visualization app on the iPhone may facilitate urgent coronary CTA review when a workstation is not available."
0000-0001-9729-2756,https://profiles.hopkinsmedicine.org/provider/linda-chu/2708877,2017,Invited commentary on “ct texture analysis”,Chu Linda C,https://pubmed.ncbi.nlm.nih.gov/28898182/,Abstract unavailable.
0000-0001-9729-2756,https://profiles.hopkinsmedicine.org/provider/linda-chu/2708877,2017,Structural and Functional Correlates of Myocardial T1 Mapping in 321 Patients with Hypertrophic Cardiomyopathy,"Chu Linda C, Corona-Villalobos Celia P, Halushka Marc K, Zhang Yan, Pozzessere Chiara, Kamel Ihab R, Pozios Iraklis, Van Der Geest Rob J, Gai Neville, Abraham Roselle M, Abraham Theodore P, Bluemke David A, Zimmerman Stefan L",https://pubmed.ncbi.nlm.nih.gov/27997439/,"The aim of this study was to evaluate the structural and functional correlates of T1 mapping in 321 patients with hypertrophic cardiomyopathy (HCM). Three hundred twenty-one patients with HCM who underwent cardiac magnetic resonance from 2003 to 2013 were retrospectively identified from our institution's HCM registry. Left ventricular volume, function, late gadolinium enhancement (LGE), and Look-Locker T1 time were quantified. T1 time was normalized to blood pool to calculate T1 ratio. Correlations between LGE%, T1 ratio, and structural and functional features were performed using Pearson correlation coefficient. Late gadolinium enhancement showed stronger correlation with left ventricular mass index (r = 0.41, P < 0.001) compared with T1 ratio (r = -0.17, P = 0.004). Both LGE% and T1 ratio correlated with ejection fraction (r = -0.18 and P = 0.002 vs r = 0.21 and P < 0.001, respectively). E/e' showed correlation with LGE% but not with T1 ratio. Late gadolinium enhancement was more strongly correlated with the phenotypic expression of HCM compared with T1 ratio."
0000-0001-9729-2756,https://profiles.hopkinsmedicine.org/provider/linda-chu/2708877,2016,Evaluation of hepatocellular carcinoma tumor response after transcatheter arterial chemoembolization using gadobenate dimeglumine-enhanced liver magnetic resonance,"Chu Linda C, Pozzessere Chiara, Corona-Villalobos Celia Pamela, Castaños Sandra, Rastegar Neda, Halappa Vivek, Bonekamp Susanne, Emurano Emi, Kamel Ihab R",https://pubmed.ncbi.nlm.nih.gov/27680411/,"Use of gadobenate dimeglumine-enhanced liver magnetic resonance (MR) for evaluation of hepatocellular carcinoma tumor response after transcatheter arterial chemoembolization (TACE). Forty-five patients with hepatocellular carcinoma were imaged with multiphase gadobenate dimeglumine-enhanced MR examination at baseline and 1-month follow-up after TACE. Nodule size, enhancement, and apparent diffusion coefficient were measured for both examinations by 2 reviewers. Changes in tumor nodule size, enhancement, and apparent diffusion coefficient were evaluated using the Student t test. Nineteen of 45 patients completed the study, and a total of 34 hepatocellular carcinoma nodules were analyzed. On the posttreatment follow up, there was no significant change in nodule size. Target lesions demonstrated significant decrease in tumor enhancement after TACE (P < 0.001). Intense contrast accumulation along the periphery of the presumed necrotic tumor on the delayed hepatobiliary phase helped to differentiate viable from non-viable tumor. Gadobenate dimeglumine-enhanced liver MR may help differentiate between viable and necrotic tumor after TACE."
0000-0001-9729-2756,https://profiles.hopkinsmedicine.org/provider/linda-chu/2708877,2016,Evaluation of left ventricular outflow tract obstruction with four-dimensional phase contrast magnetic resonance imaging in patients with hypertrophic cardiomyopathy-a pilot study,"Chu Linda C, Porter Kristin K, Corona-Villalobos Celia Pamela, Gülsün Mehmet Akif, Shea Steven M, Markl Michael, Abraham Theodore P, Bluemke David A, Kamel Ihab R, Zimmerman Stefan L",https://pubmed.ncbi.nlm.nih.gov/27529682/,"This study aimed to validate 4-dimensional phase contrast (4D PC) cine magnetic resonance imaging (MRI) as a means of evaluating left ventricular outflow tract (LVOT) obstruction in patients with hypertrophic cardiomyopathy (HCM). In this institutional review board-approved prospective study, 23 patients with suspected HCM from October 2012 to September 2013 underwent 4D PC MRI. Postprocessed 4D PC pathline cine data were reviewed by 2 blinded reviewers to determine presence or absence of LVOT obstruction. Sensitivity, specificity, and accuracy in 4D PC qualitative and quantitative assessment of LVOT obstruction were calculated using echo as reference standard. Consensus interpretation of 4D PC showed 100.0% (7/7) sensitivity, 75.0% specificity (12/16), and 82.6% (19/23) accuracy in assessment of LVOT obstruction. The 4D PC quantitative estimates of LVOT gradient have 71.4% (5/7) sensitivity, 93.8% (15/16) specificity, and 87.0% (20/23) accuracy in evaluation of LVOT obstruction compared with echo. The 4D PC MRI can assess for LVOT obstruction in HCM patients."
0000-0001-9729-2756,https://profiles.hopkinsmedicine.org/provider/linda-chu/2708877,2016,Left ventricular wall thickness in patients with hypertrophic cardiomyopathy: a comparison between cardiac magnetic resonance imaging and echocardiography,"Corona-Villalobos Celia P, Sorensen Lars L, Pozios Iraklis, Chu Linda, Eng John, Abraham Maria Roselle, Abraham Theodore P, Kamel Ihab R, Zimmerman Stefan L",https://pubmed.ncbi.nlm.nih.gov/26896038/,"We assessed whether cardiac MRI (CMR) and echocardiography (echo) have significant differences measuring left ventricular (LV) wall thickness (WT) in hypertrophic cardiomyopathy (HCM) as performed in the clinical routine. Retrospectively identified, clinically diagnosed HCM patients with interventricular-septal (IVS) pattern hypertrophy who underwent CMR and echo within the same day were included. Left Ventricular WT was measured by CMR in two planes and compared to both echo and contrast echo (cecho). 72 subjects, mean age 50.7 ± 16.2 years, 68 % males. Interventricular septal WT by echo and CMR planes showed good to excellent correlation. However, measurements of the postero-lateral wall showed poor correlation. Bland-Altman plots showed greater maximal IVS WT by echo compared to CMR measurement [SAX = 1.7 mm (-5.8, 9.3); LVOT = 1.1 mm (-5.6, 7.8)]. Differences were smaller between cecho and CMR [SAX = 0.8 mm (-9.2, 10.8); LVOT = -0.2 mm (-10.0, 9.6)]. Severity of WT by quartiles showed greater differences between echo and SAX CMR WT compared to cecho. Echocardiography typically measures greater WT than CMR, with the largest differences in moderate to severe hypertrophy. Contrast echocardiography more closely approximates CMR measurements of WT. These findings have potential clinical implications for risk stratification of subjects with HCM."
0000-0001-9729-2756,https://profiles.hopkinsmedicine.org/provider/linda-chu/2708877,2016,Posttreatment FDG PET/CT in predicting survival of patients with ovarian carcinoma,"Chu Linda C, Tsai Hua-Ling, Wang Hao, Crandall John, Javadi Mehrbod S, Wahl Richard L",https://pubmed.ncbi.nlm.nih.gov/27206785/,"The purposes of this study are to evaluate the prognostic value of posttreatment (18)F-FDG PET/CT in predicting the survival of patients with ovarian carcinoma and to determine incremental value of combining posttreatment PET/CT with traditional prognostic factors in a multivariate model. This was an IRB-approved retrospective study. From July 2001 to July 2011, 48 patients who completed initial therapy for ovarian carcinoma with concurrent 3- to 9-month initial posttreatment (18)F-FDG PET/CT and serum CA-125 were identified from the radiology database. Prognostic value of posttreatment PET/CT, CA-125, age, race, and tumor stage were determined from Cox proportional hazard model using univariate and multivariate analyses. Time-dependent receiver operator curves were also calculated at various follow-up intervals. In a univariate model, overall survival (OS) was associated with PET/CT (hazard ratio = 4.18; 95 % CI 1.49-11.70) and CA-125 (hazard ratio = 11.09; 95 % CI 4.27-28.79). When the effects of posttreatment PET/CT and CA-125 were combined in the multivariate analysis, hazard ratio for PET/CT increased to 4.84 (95 % CI 1.59-14.73, p = 0.005) and hazard ratio for CA-125 increased to 14.43 (95 % CI 4.65-44.84, p < 0.001). In the subset of patients with negative CA-125, posttreatment PET/CT had a hazard ratio of 2.98 (95 % CI 0.86-10.37), supporting the role of posttreatment PET/CT in risk stratification of patients with negative CA-125. Time-dependent receiver operator curves showed that the combination of PET/CT and CA-125 improved prognostic accuracy compared to PET/CT or CA-125 alone at 12-, 24-, 30-, and 36-month follow-up. Posttreatment PET/CT can predict the survival of patients with ovarian carcinoma. The addition of posttreatment PET/CT to the CA-125 serum biomarker has an incremental value in improving prognostic accuracy, particularly in the subset of patients with negative CA-125."
0000-0001-9729-2756,https://profiles.hopkinsmedicine.org/provider/linda-chu/2708877,2016,Remote reading of coronary CTA exams using a tablet computer: utility for stenosis assessment and identification of coronary anomalies,"Zimmerman Stefan L, Lin Cheng T, Chu Linda C, Eng John, Fishman Elliot K",https://pubmed.ncbi.nlm.nih.gov/27085532/,"The feasibility of remote reading of coronary CT examinations on tablet computers has not been evaluated. The purpose of this study is to evaluate the accuracy of coronary CT angiography reading using an iPad compared to standard 3D workstations. Fifty coronary CT angiography exams, including a spectrum of coronary artery disease and anatomic variants, were reviewed. Coronary CT angiography exams were interpreted by two readers independently on an iPad application (Siemens Webviewer) and a clinical 3D workstation at sessions 2 weeks apart. Studies were scored per vessel for severity of stenosis on a 0-3 scale (0 none, 1 0.05). Both readers identified 100 % of coronary anomalies using each technique. Reading of coronary CT angiography examinations on the iPad had no influence on stenosis assessment compared to the standard clinical workstation."
