ORCID,Hopkins Profile,Year,Title,Authors,PubMed Link,Abstract
0000-0002-2450-4014,https://profiles.hopkinsmedicine.org/provider/vivek-yedavalli/2709369,2024,Pretreatment predictors of very poor clinical outcomes in medium vessel occlusion stroke patients treated with mechanical thrombectomy,"Yedavalli Vivek, Salim Hamza, Musmar Basel, Adeeb Nimer, El Naamani Kareem, Henninger Nils, Sundararajan Sri Hari, Kühn Anna Luisa, Khalife Jane, Ghozy Sherief, Scarcia Luca, Tan Benjamin Yq, Heit Jeremy J, Regenhardt Robert W, Cancelliere Nicole M, Bernstock Joshua D, Rouchaud Aymeric, Fiehler Jens, Sheth Sunil, Essibayi Muhammed Amir, Puri Ajit S, Dyzmann Christian, Colasurdo Marco, Barreau Xavier, Renieri Leonardo, Filipe João Pedro, Harker Pablo, Radu Răzvan Alexandru, Marotta Thomas R, Spears Julian, Ota Takahiro, Mowla Ashkan, Jabbour Pascal, Biswas Arundhati, Clarençon Frédéric, Siegler James E, Nguyen Thanh N, Varela Ricardo, Baker Amanda, Altschul David, Gonzalez Nestor R, Möhlenbruch Markus A, Costalat Vincent, Gory Benjamin, Paul Stracke Christian, Aziz-Sultan Mohammad Ali, Hecker Constantin, Shaikh Hamza, Liebeskind David S, Pedicelli Alessandro, Alexandre Andrea M, Tancredi Illario, Faizy Tobias D, Kalsoum Erwah, Lubicz Boris, Patel Aman B, Pereira Vitor Mendes, Guenego Adrien, Dmytriw Adam A",https://pubmed.ncbi.nlm.nih.gov/39075759/,"Acute ischemic stroke (AIS) from primary medium vessel occlusions (MeVO) is a prevalent condition associated with substantial morbidity and mortality. Despite the common use of mechanical thrombectomy (MT) in AIS, predictors of poor outcomes in MeVO remain poorly characterized. In this prospectively collected, retrospectively reviewed, multicenter, multinational study, data from the MAD-MT (Multicenter Analysis of primary Distal medium vessel occlusions: effect of Mechanical Thrombectomy) registry were analyzed. The study included 1568 patients from 37 academic centers across North America, Asia, and Europe, treated with MT, with or without intravenous tissue plasminogen activator (IVtPA), between September 2017 and July 2021. Among the 1568 patients, 347 (22.2%) experienced very poor outcomes (modified Rankin score (mRS), 5-6). Key predictors of poor outcomes were advanced age (odds ratio (OR): 1.03; 95% confidence interval (CI): 1.02 to 1.04; p < 0.001), higher baseline National Institutes of Health Stroke Scale (NIHSS) scores (OR: 1.07; 95% CI: 1.05 to 1.10; p < 0.001), pre-operative glucose levels (OR: 1.01; 95% CI: 1.00 to 1.02; p < 0.001), and a baseline mRS of 4 (OR: 2.69; 95% CI: 1.25 to 5.82; p = 0.011). The multivariable model demonstrated good predictive accuracy with an area under the receiver-operating characteristic (ROC) curve of 0.76. This study demonstrates that advanced age, higher NIHSS scores, elevated pre-stroke mRS, and pre-operative glucose levels significantly predict very poor outcomes in AIS-MeVO patients who received MT. These findings highlight the importance of a comprehensive risk assessment in primary MeVO patients for personalized treatment strategies. However, they also suggest a need for cautious patient selection for endovascular thrombectomy. Further prospective studies are needed to confirm these findings and explore targeted therapeutic interventions."
0000-0002-2450-4014,https://profiles.hopkinsmedicine.org/provider/vivek-yedavalli/2709369,2024,AM-PAC 6-Clicks Basic Mobility and Daily Activities Scores Predict 90-Day Modified Rankin Score in Patients with Acute Ischemic Stroke Secondary to Large Vessel Occlusion,"Cho Andrew, Lakhani Dhairya A, Balar Aneri B, Salim Hamza, Koneru Manisha, Hillis Argye, Gonzalez Fernández Marlis, Vagal Vaibhav, Urrutia Victor, Faizy Tobias D, Heit Jeremy J, Albers Greg W, Mazumdar Ishan, Chen Kevin, Sepehri Sadra, Kim Minsoo, Luna Licia, Mei Janet, Yedavalli Vivek S, Hyson Nathan",https://pubmed.ncbi.nlm.nih.gov/39685578/,"Background: The relative level of functional impairment in stroke patients is a significant determinant of post-acute care. The Activity Measure for Post Acute Care 6-Clicks (AM-PAC) scores for basic mobility and daily activity are rapid standardized assessments whose utilities in predicting long-term stroke outcomes have not yet been studied. Methods: We performed a retrospective analysis of acute ischemic stroke patients and their outcomes. We evaluated the distribution of outcomes using the chi-square test. We then compared the proportions of patients with good stroke outcomes for different combinations of favorable scores. We performed two-proportion z-tests to determine the significance, and p < 0.05 was considered significant. Results: 282 patients met all of the inclusion criteria between 12 January 2017 and 19 March 2023 (M age = 66.4, 59.9% female). After dichotomizing the scores as ""favorable"" vs. ""unfavorable"", we found that 128/155 (82.6%) patients with favorable basic mobility had good stroke outcomes vs. 20/127 (15.7%) with unfavorable basic mobility (p < 0.0001). Similarly, for favorable daily activity, it was 103/113 (91.2%) vs. 45/169 (26.6%), for both favorable, it was 100/109 (91.7%) vs. 48/173 (27.7%), and for neither favorable, it was 17/123 (13.8%) vs. 131/159 (82.4%), all with p < 0.0001. When comparing among groups, both favorable patients differed significantly from those with favorable basic mobility alone (p = 0.033) but not those with favorable daily activity alone (p = 0.875). Even after adjusting for age, the odds ratios of favorable scores were greater than 20 for any combination (p < 0.001). Conclusions: Basic mobility and daily activity AM-PAC scores at discharge are independent predictors of anterior circulation acute ischemic stroke outcomes at 90 days."
0000-0002-2450-4014,https://profiles.hopkinsmedicine.org/provider/vivek-yedavalli/2709369,2024,Predictors and Outcomes of Excellent Recanalization Versus Successful Recanalization After Thrombectomy in Proximal and Distal Medium Vessel Occlusion Strokes: A Multinational Study,"Yedavalli Vivek, Salim Hamza Adel, Musmar Basel, Adeeb Nimer, Naamani Kareem El, Henninger Nils, Sundararajan Sri Hari, Kühn Anna Luisa, Khalife Jane, Ghozy Sherief, Scarcia Luca, Tan Benjamin Y Q, Heit Jeremy J, Regenhardt Robert W, Cancelliere Nicole M, Bernstock Joshua D, Rouchaud Aymeric, Fiehler Jens, Sheth Sunil, Essibayi Muhammed Amir, Puri Ajit S, Dyzmann Christian, Colasurdo Marco, Barreau Xavier, Renieri Leonardo, Filipe João Pedro, Harker Pablo, Radu Răzvan Alexandru, Abdalkader Mohamad, Klein Piers, Marotta Thomas R, Spears Julian, Ota Takahiro, Mowla Ashkan, Jabbour Pascal, Biswas Arundhati, Clarençon Frédéric, Siegler James E, Nguyen Thanh N, Varela Ricardo, Baker Amanda, Altschul David, Gonzalez Nestor R, Möhlenbruch Markus A, Costalat Vincent, Gory Benjamin, Stracke Christian Paul, Aziz-Sultan Mohammad Ali, Hecker Constantin, Shaikh Hamza, Liebeskind David S, Pedicelli Alessandro, Alexandre Andrea M, Tancredi Illario, Faizy Tobias D, Kalsoum Erwah, Lubicz Boris, Patel Aman B, Pereira Vitor Mendes, Guenego Adrien, Dmytriw Adam A",https://pubmed.ncbi.nlm.nih.gov/41583405/,"Acute ischemic stroke arising from medium vessel occlusions (MeVO) poses substantial challenges in treatment and management. This study aims to elucidate the outcomes and factors contributing to achieving excellent recanalization (modified Thrombolysis in Cerebral Infarction [mTICI] 2c-3) versus successful recanalization (mTICI 2b) in patients with MeVO stroke undergoing mechanical thrombectomy (MT). We conducted a multinational study analyzing data from the MAD-MT (Multicenter Analysis of Distal Medium Vessel Occlusions: Effect of Mechanical Thrombectomy) registry, encompassing 37 centers across North America, Asia, and Europe, collected between September 2017 and July 2023. The study included acute ischemic stroke patients with MeVO treated with MT, with or without intravenous thrombolysis, who achieved mTICI 2b-3 post-MT. Among 1463 patients with successful recanalization (mTICI 2b-3), 523 achieved mTICI 2b recanalization, and 940 achieved mTICI 2c-3. Distal occlusions exhibited higher odds of excellent recanalization compared with proximal MeVO vessel occlusions (odds ratio, 1.58; 95% CI, 1.17-2.15; This study underscores that among patients with MeVO stroke with successful recanalization (mTICI 2b-3) there is higher likelihood of achieving excellent recanalization (mTICI 2c-3) in distal occlusions and cardioembolic pathogenesis. mTICI 2c-3 scores post-MT correlate with improved clinical outcomes compared with mTICI 2b, affirming the superiority of excellent recanalization over successful recanalization in patients with MeVO stroke. Further prospective studies and randomized controlled trials are warranted for validation."
0000-0002-2450-4014,https://profiles.hopkinsmedicine.org/provider/vivek-yedavalli/2709369,2024,Decreased Quantitative Cerebral Blood Volume Is Associated With Poor Outcomes in Large Core Patients,"Yedavalli Vivek, Salim Hamza Adel, Mei Janet, Lakhani Dhairya A, Balar Aneri, Musmar Basel, Adeeb Nimer, Hoseinyazdi Meisam, Luna Licia, Deng Francis, Hyson Nathan Z, Dmytriw Adam A, Guenego Adrien, Faizy Tobias D, Heit Jeremy J, Albers Gregory W, Lu Hanzhang, Urrutia Victor C, Nael Kambiz, Marsh Elisabeth B, Hillis Argye E, Llinas Raf",https://pubmed.ncbi.nlm.nih.gov/39185560/,"Recent large core trials have highlighted the effectiveness of mechanical thrombectomy (MT) in acute ischemic stroke with large vessel occlusion. Variable perfusion-imaging thresholds and poor Alberta Stroke Program Early Computed Tomography Score reliability underline the need for more standardized, quantitative ischemia measures for MT patient selection. We aimed to identify the computed tomography perfusion parameter most strongly associated with poor outcomes in patients with acute ischemic stroke-large vessel occlusion with significant ischemic cores. In this study from 2 comprehensive stroke centers from 2 comprehensive stroke centers within the Johns Hopkins Medical Enterprise (Johns Hopkins Hospita-East Baltimore and Bayview Medical Campus) from July 29, 2019 to January 29, 2023 in a continuously maintained database, we included patients with acute ischemic stroke-large vessel occlusion with ischemic core volumes defined as relative cerebral blood flow <30% and ≥50 mL on computed tomography perfusion or Alberta Stroke Program Early Computed Tomography Score <6. We used receiver operating characteristics to find the optimal cutoff for parameters like cerebral blood volume (CBV) 20%, 30%, 34%, 38%, and time-to-maximum >4, 6, 8, and 10 seconds. The primary outcome was unfavorable outcomes (90-day modified Rankin Scale score 4-6). Multivariable models were adjusted for age, sex, diabetes, baseline National Institutes of Health Stroke Scale, intravenous thrombolysis, and MT. We identified 59 patients with large ischemic cores. A receiver operating characteristic curve analysis showed that CBV8 and 10 seconds volumes, higher CBV volumes, higher HIR, and lower CBV index. The multivariable model incorporating CBV<42% ≥68 mL predicted poor outcomes robustly in both cohorts (area under the curve for MT-only subgroup was 0.87 [95% CI, 0.75-1.00]). CBV<42% ≥68 mL most effectively forecasts poor outcomes in patients with large-core stroke, confirming its value alongside other parameters like time-to-maximum in managing acute ischemic stroke-large vessel occlusion."
0000-0002-2450-4014,https://profiles.hopkinsmedicine.org/provider/vivek-yedavalli/2709369,2024,Repeat percutaneous rhizotomy for trigeminal neuralgia is not associated with an increased risk of postoperative complications,"Nair Sumil K, Kalluri Anita, Ejimogu Nna-Emeka, Reddy Sai Chandan, Tantry Deepti, Wang Xihang, Carmichael Austin, Abdulrahim Mostafa, Xia Yuanxuan, Yedavalli Vivek, Jackson Christopher M, Huang Judy, Lim Michael, Bettegowda Chetan, Xu Risheng",https://pubmed.ncbi.nlm.nih.gov/39116792/,"Patients undergoing percutaneous rhizotomy for trigeminal neuralgia (TN) may require several procedures to manage their pain. However, it is not fully understood whether repeat procedures influence postoperative complication rates. We retrospectively reviewed patients undergoing rhizotomy at our institution from 2011 to 2022. Patients were included only if they had no history of prior interventions including microvascular decompression (MVD) or radiosurgery. We collected baseline patient information, pain characteristics, and postoperative complications for each patient. Patients were dichotomized into those undergoing primary rhizotomy versus those undergoing a repeat rhizotomy. Potential drivers of postoperative complications were included in a multivariate logistic regression model. Of the 1904 cases reviewed, 965 met our inclusion criteria. 392 patients underwent primary rhizotomy, and 573 patients underwent repeat rhizotomies. The repeat rhizotomy group was significantly older, p<0.001. Patients in the repeat rhizotomy group expressed higher frequencies of bilateral pain, p=0.01. Patients in the repeat rhizotomy group demonstrated a significantly higher rate of preoperative numbness and postoperative numbness, p<0.001. There were no significant differences in any of the considered complications between the single rhizotomy and repeat rhizotomy groups. On multivariate logistic regression, repeat rhizotomy did not predict an increased risk of any postoperative complications, p=0.14. Patients undergoing repeat rhizotomy may be at risk of postoperative numbness but are not at increased risk for postoperative complications. These results are of use to patients who are poor surgical candidates, and thus may require multiple rhizotomies to effectively manage their pain over time."
0000-0002-2450-4014,https://profiles.hopkinsmedicine.org/provider/vivek-yedavalli/2709369,2024,Artificial intelligence/machine learning for neuroimaging to predict hemorrhagic transformation: Systematic review/meta‐analysis,"Dagher Richard, Ozkara Burak Berksu, Karabacak Mert, Dagher Samir A, Rumbaut Elijah Isaac, Luna Licia P, Yedavalli Vivek S, Wintermark Max",https://pubmed.ncbi.nlm.nih.gov/39034604/,"Early and reliable prediction of hemorrhagic transformation (HT) in patients with acute ischemic stroke (AIS) is crucial for treatment decisions and early intervention. The purpose of this study was to conduct a systematic review and meta-analysis on the performance of artificial intelligence (AI) and machine learning (ML) models that utilize neuroimaging to predict HT. A systematic search of PubMed, EMBASE, and Web of Science was conducted until February 19, 2024. Inclusion criteria were as follows: patients with AIS who received reperfusion therapy; AI/ML algorithm using imaging to predict HT; or presence of sufficient data on the predictive performance. Exclusion criteria were as follows: articles with less than 20 patients; articles lacking algorithms that operate solely on images; or articles not detailing the algorithm used. The quality of eligible studies was assessed using the Quality Assessment of Diagnostic Accuracy Studies-2 and Checklist for Artificial Intelligence in Medical Imaging. Pooled sensitivity, specificity, and diagnostic odds ratio (DOR) were calculated using a random-effects model, and a summary receiver operating characteristic curve was constructed using the Reitsma method. We identified six eligible studies, which included 1640 patients. Aside from an unclear risk of bias regarding flow and timing identified in two of the studies, all studies showed low risk of bias and applicability concerns in all categories. Pooled sensitivity, specificity, and DOR were .849, .878, and 45.598, respectively. AI/ML models can reliably predict the occurrence of HT in AIS patients. More prospective studies are needed for subgroup analyses and higher clinical certainty and usefulness."
0000-0002-2450-4014,https://profiles.hopkinsmedicine.org/provider/vivek-yedavalli/2709369,2024,Prolonged Venous Transit Is Associated With Lower Likelihood of Favorable Clinical Recovery in Reperfused Anterior Circulation Large‐Vessel Occlusion Stroke,"Yedavalli Vivek S, Koneru Manisha, Balar Aneri B, Lakhani Dhairya A, Cho Andrew, Wen Sijin, Mei Yanqing, Hoseinyazdi Meisam, Greene Cynthia, Xu Risheng, Luna Licia P, Caplan Justin M, Dmytriw Adam A, Guenego Adrien, Heit Jeremy J, Albers Gregory W, Wintermark Max, Gonzalez Luis Fernando, Urrutia Victor C, Huang Judy, Nael Kambiz, Faizy Tobias D, Leigh Richard, Marsh Elisabeth B, Hillis Argye E, Llinas Rafael H",https://pubmed.ncbi.nlm.nih.gov/41586279/,"Unfavorable clinical outcomes in patients with acute ischemic stroke caused by large-vessel occlusions despite successful reperfusion have been associated with poor venous outflow. The objective of this study is to assess the relationship between prolonged venous transit (PVT), a novel perfusion imaging surrogate for poor venous outflow, and likelihood of favorable clinical recovery. In this retrospective review of prospectively collected data of consecutive patients (2017-2022) with successfully reperfused, anterior circulation acute ischemic stroke caused by large-vessel occlusions, we assessed the association between PVT+, defined as time to maximum ≧10-second timing delays within either the posterior superior sagittal sinus, torcula, or both regions on pretreatment perfusion imaging, and favorable clinical outcomes defined as 90-day modified Rankin Scale score of 0 to 2. Patients were dichotomized into PVT+ and PVT- for analysis. Multivariable logistic regression analyses for favorable recovery were performed with demographic variables and stroke characteristics. A total of 127 consecutive patients (median age, 71 [interquartile range 61-77] years; 59.1% women) were included, and 40 of 127 (31.5%) were PVT+. PVT+ (adjusted odds ratio [aOR], 0.23 [95% CI, 0.07-0.81]; PVT+ was associated with a lower likelihood of achieving favorable clinical recovery in successfully reperfused patients with acute ischemic stroke caused by large vessel occlusion. PVT may serve as a clinically useful adjunctive imaging parameter."
0000-0002-2450-4014,https://profiles.hopkinsmedicine.org/provider/vivek-yedavalli/2709369,2024,Racial disparities in functional outcomes following mechanical thrombectomy in a cohort of patients with ischemic stroke,"Srinivas Tara, Ran Kathleen, Nair Sumil K, Hung Alice, Young Christopher C, Tamargo Rafael J, Huang Judy, Marsh Elizabeth, Hillis Argye, Yedavalli Vivek, Urrutia Victor, Gailloud Philippe, Caplan Justin M, Gonzalez L Fernando, Xu Risheng",https://pubmed.ncbi.nlm.nih.gov/37532451/,"Non-Hispanic Black (NHB) patients experience increased prevalence of stroke risk factors and stroke incidence compared with non-Hispanic White (NHW) patients. However, little is known about >90-day post-stroke functional outcomes following mechanical thrombectomy. To describe patient characteristics, evaluate stroke risk factors, and analyze the adjusted impact of race on long-term functional outcomes to better identify and limit sources of disparity in post-stroke care. We retrospectively reviewed 326 patients with ischemic stroke who underwent thrombectomy at two centers between 2019 and 2022. Race was self-reported as NHB, NHW, or non-Hispanic Other. Stroke risk factors, insurance status, procedural parameters, and post-stroke functional outcomes were collected. Good outcomes were defined as modified Rankin Scale score ≤2 and/or discharge disposition to home/self-care. To assess the impact of race on outcomes at 3-, 6-, and 12-months' follow-up, we performed univariate and multivariate logistic regression. Patients self-identified as NHB (42%), NHW (53%), or Other (5%). 177 (54.3%) patients were female; the median (IQR) age was 67.5 (59-77) years. The median (IQR) National Institutes of Health Stroke Scale score was 15 (10-20). On univariate analysis, NHB patients were more likely to have poor short- and long-term functional outcomes, which persisted on multivariate analysis as significant at 3 and 6 months but not at 12 months (3 months: OR=2.115, P=0.04; 6 months: OR=2.423, P=0.048; 12 months: OR=2.187, P=0.15). NHB patients were also more likely to be discharged to rehabilitation or hospice/death than NHW patients after adjusting for confounders (OR=1.940, P=0.04). NHB patients undergoing thrombectomy for ischemic stroke experience worse 3- and 6-month functional outcomes than NHW patients after adjusting for confounders. Interestingly, this disparity was not detected at 12 months. Future research should focus on identifying social determinants in the short-term post-stroke recovery period to improve parity in stroke care."
0000-0002-2450-4014,https://profiles.hopkinsmedicine.org/provider/vivek-yedavalli/2709369,2024,Exploring the Limits of Endovascular Therapy for Large Core Patients: Where Do We Need More Data?,"Albers Gregory W, Heit Jeremy J, Lansberg Maarten G, Inoue Manabu, Huo Xiaochuan, Yedavalli Vivek S, Seners Pierre, McCullough-Hicks Margy, Cereda Carlo W, Tsai Jenny P, Mistry Eva A, Chatterjee Arindam R, Derdeyn Colin P, Khatri Pooja, Olivot J M, Hill Michael D, Saver Jeffrey L, Fisher Marc",https://pubmed.ncbi.nlm.nih.gov/38836345/,"Endovascular therapy; large core; stroke imaging; CT perfusionThe six randomized large core stroke trials reported or published between 2022 and 2024 have expanded the selection criteria for endovascular therapy (EVT) demonstrating that patients with lower Alberta Stroke Program Early CT (ASPECT) scores and larger CTperfusion (CTP) or diffusion-weighted imaging (DWI) core volumes benefit from EVT [1-6].There are, however, several patient subgroups that were underrepresented in the randomized trials, as well as heterogeneity in study designs and treatment responses.This brings into question which subgroups of patients with large cores benefit from EVT.Some trials focused on MRI-based selection (DWI-ASPECTS), others included patients who had both non-contrast CT (NCCT) and CTP, while others required only a NCCT and enrolled based on ASPECTS criteria (see Table 1).Some studies were restricted to early time windows, while others treated patients up to 24 hours after last know well.Subgroups with an uncertain response to EVT include CT ASPECT or DWI-ASPECT scores between 0-3 in in the early time window, large core volumes on CTP or MRI (especially in later treatment windows), and those with no perfusion imaging mismatch in any time window.Patients with baseline disability were not represented as a premorbid modified Rankin Score (mRS) 1 was required for all trials except TENSION, which allowed mRS 0-2.Those of age greater than 80 years were also under-represented as the mean ages of the patients enrolled was in the mid-late 60s in TESLA, SELECT2, and ANGEL-ASPECT and in the mid 70s in the other three studies."
0000-0002-2450-4014,https://profiles.hopkinsmedicine.org/provider/vivek-yedavalli/2709369,2024,Relative Improvement in Language vs Motor Functions with Reperfusion Therapies for Acute Stroke due to Large Vessel Occlusion,"Ahmad Zaka, Yedavalli Vivek, Gonzalez Wladimir Sarmiento, Hillis Argye E",https://pubmed.ncbi.nlm.nih.gov/38978653/,"When weighing potential risks versus benefits of reperfusion therapy, the functions likely to recover if blood flow can be restored should be considered. Because deep and motor areas of the brain often infarct relatively early in acute stroke, we hypothesized that reperfusion therapies are more likely to improve language function and neglect (cortical functions) more than motor function. In this retrospective review of a prospectively collected database, patients with acute stroke due to large vessel occlusion), we evaluated percent improvement (mean change in score/maximum score) for different items of the National Institutes of Health Score Scale with and without endovascular thrombectomy, and/or intravenous thrombolysis. In total, 290 patients (mean age 61.8; SD 14.0; 47.9% female) met the inclusion criteria. For all outcome measures (percent change in language, total language, motor, and neglect) there were significant effects of treatment group (p<0.0001 for all), with the greatest change in the EVT +tPA group, then EVT only group, followed by tPA only, followed by no intervention. Differences between EVT + tPA and EVT only were not significant (p=.30 to 0.79 across outcomes). For patients with aphasia and/or right sided weakness before treatment, the percent change in language was significantly greater than the percent change in weakness (29.8% vs. 12.7%; t(93)=5.3;p<0.0001). Greater percent improvement in language was observed in all treatment groups (p=0.0003 to 0.03 across treatment groups). In patients with acute ischemic stroke due to LVO, improvements in all neurological functions occur with tPA, and even more with EVT (with and without IV tPA). However, gains in language are even greater than gains in motor function with both interventions. Few patients had neglect before treatment, but of those who did, the majority improved, and most (92.8%) improved with EVT."
