ORCID,Hopkins Profile,Year,Title,Authors,PubMed Link,Abstract
0000-0002-2450-4014,https://profiles.hopkinsmedicine.org/provider/vivek-yedavalli/2709369,2026,Activity measure post-acute care score for discharge outcomes is associated with prolonged venous transit on perfusion imaging in reperfused large vessel occlusion strokes,"Koneru Manisha, Mei Janet Y, Lakhani Dhairya A, Balar Aneri B, Hoseinyazdi Meisam, Salim Hamza A, Ozkara Burak Berksu, Luna Licia P, Deng Francis, Hyson Nathan Z, Dmytriw Adam A, Guenego Adrien, Heit Jeremy J, Albers Gregory W, Wolman Dylan, Faizy Tobias D, Pulli Benjamin, Wintermark Max, Wen Sijin, Vagal Vaibhav, Sriwastwa Aakanksha, Aziz Yasmin, Xu Risheng, Lu Hanzhang, Urrutia Victor C, Marsh Elisabeth B, Leigh Richard, Bahouth Mona, Llinas Rafael H, Nael Kambiz, Gonzalez-Fernandez Marlis, Hillis Argye E, Yedavalli Vivek S",https://pubmed.ncbi.nlm.nih.gov/41532474/,"Activity Measure for Post-Acute Care (AM-PAC) score is used in discharge planning for patients with acute ischemic stroke from a large vessel occlusion (AIS-LVO). Prolonged venous transit (PVT) is a binary, qualitative measure visually ascertained from computed tomography perfusion imaging time-to-maximum (Tmax) maps. PVT has been associated with unfavorable recovery and mortality. To assess the robustness of PVT by evaluating its association with AM-PAC. Consecutive adult patients with AIS-LVO treated successfully with reperfusion therapy were retrospectively reviewed. PVT+ is defined as Tmax Among 121 patients, the median age was 72 (interquartile range, 64-81) years. Favorable AM-PAC scores occurred less often in PVT+ than PVT- patients (10.5% vs. 45.8%). PVT+ was associated with significantly reduced odds of favorable AM-PAC score in multivariable regressions (PVT+ vs. PVT- odds ratio [OR]: 0.11, 95% confidence interval [CI]: 0.03-0.48, p = .01); the significant association furthermore persisted in the matched cohort analysis (PVT+ vs. PVT- OR: 0.73, 95% CI: 0.60-0.88, p < .001). PVT+ is independently associated with lower odds of favorable AM-PAC scores at discharge. Logistically-consistent associations with short-term and long-term clinical outcomes augment our understanding of PVT and further establish the potential of this novel imaging parameter as an informative metric in clinical practice."
0000-0002-2450-4014,https://profiles.hopkinsmedicine.org/provider/vivek-yedavalli/2709369,2026,Gradient Scheme Optimization for PRESS-Localized Edited MRS Using Weighted Pathway Suppression,"Simegn Gizeaddis L, Shams Zahra, Murali-Manohar Saipavitra, Simicic Dunja, Gad Abdelrahman, Song Yulu, Yedavalli Vivek, Davies-Jenkins Christopher W, Gudmundson Aaron T, Zöllner Helge J, Oeltzschner Georg, Edden Richard A E",https://pubmed.ncbi.nlm.nih.gov/41261502/,"This study aimed to design and implement an optimized gradient scheme for PRESS-localized edited magnetic resonance spectroscopy (MRS) to enhance suppression of out-of-voxel (OOV) artifacts. These artifacts, which originate from insufficient crushing of unwanted coherence transfer pathways (CTPs), are particularly challenging in editing schemes for metabolites like gamma-aminobutyric acid and glutathione. To address this, a volume-based likelihood model was developed to guide gradient scheme optimization, prioritizing suppression of CTPs based on likelihood. The volume-based likelihood model for CTP weighting was integrated into a Dephasing optimization through coherence order pathway selection (DOTCOPS) gradient optimization. Using a genetic algorithm with a weighted dual-penalty cost function, gradient schemes were optimized to maximize pathway-specific suppression. Hardware and sequence constraints, maximum gradient amplitudes and delay durations respectively, informed the optimization. Validation of the optimized scheme was performed with simulations by calculating the k-space crushing efficiency analytically with k-space trajectory and in vivo using an edited MRS sequence in three brain regions (posterior cingulate cortex PCC, thalamus, and medial prefrontal cortex [mPFC]), with particular focus on OOV artifact reduction and spectral quality improvements. A three-way Analysis of Variance was used to assess the significance level of OOV artifact reduction. The optimized gradient scheme demonstrated improved k-space crushing efficiency (by an average of 197%). OOV artifacts were reduced in all brain regions, particularly in highly OOV-susceptible regions (thalamus and mPFC). Improvements were most notable around 4.3 ppm with significant OOV artifact amplitude reductions (p < 0.001). By using a volume-based likelihood model for CTP prioritization, the optimized DOTCOPS scheme ensures robust and region-agnostic performance in reducing OOV artifacts."
0000-0002-2450-4014,https://profiles.hopkinsmedicine.org/provider/vivek-yedavalli/2709369,2025,Navigating the Frontier of artificial intelligence implementation in radiology – part 1: Performance assessment,"Farhat Maguy, Dagher Samir A, Ozkara Burak Berksu, Ozcan Berat Bersu, Karabacak Mert, Chen Melissa M, Yedavalli Vivek S, Wintermark Max",https://pubmed.ncbi.nlm.nih.gov/41408951/,"Despite the exponential growth in academic publications and industrial investments in artificial intelligence (AI) in medical imaging, clinical translation remains disproportionately low. Notably, the absence of internationally recognized guidelines for evaluating AI model performance and ethical considerations creates a critical gap in current practices. In this regard, we aim to offer a practical concise perspective exploring performance challenges to implementation while focusing on their mitigation. The dialog continues in subsequent work (part 2) which focuses on ethical issues. In this part, we explore the challenges inherent to the performance evaluation of AI in radiology, focusing on data heterogeneity, the choice of performance metrics and their interpretability, and data access. By shedding light on these issues and discussing potential opportunities, this work contributes to the ongoing dialog surrounding the practical integration of AI in clinical settings. It highlights the imperative need for established guidelines to ensure the safe and efficient deployment of AI technologies in medical imaging, ultimately bridging the gap between theoretical potential and practical implementation."
0000-0002-2450-4014,https://profiles.hopkinsmedicine.org/provider/vivek-yedavalli/2709369,2025,Effect of early versus delayed middle meningeal artery embolization on clinical outcomes in chronic subdural hematoma: A propensity score-matched cohort study,"Salim Hamza Adel, Hajjeh Orabi, Chen Huanwen, Essibayi Muhammed Amir, Adeeb Nimer, Msherghi Ahmed, Dmytriw Adam A, Colasurdo Marco, Malhotra Ajay, Yedavalli Vivek S, Gandhi Dheeraj, Wintermark Max, Lakhani Dhairya A",https://pubmed.ncbi.nlm.nih.gov/40914051/,"Chronic subdural hematoma (cSDH) is a common neurosurgical condition with a high recurrence rate following surgical evacuation. Middle meningeal artery embolization (MMAE) has emerged as an adjunctive or standalone treatment, but the optimal timing of embolization remains unclear. We evaluated whether early MMAE (≤2 days) versus delayed MMAE (3-7 days) is associated with improved clinical outcomes. In this retrospective, multicenter cohort study, we identified adult patients with cSDH who underwent MMAE using de-identified real-world patient data from the TriNetX platform. Patients were stratified into early versus delayed MMAE groups, defined relative to the date of surgery (surgical cohort) or diagnosis (non-surgical cohort). Propensity score matching (1:1) was performed based on demographics and comorbidities. The primary outcome was all-cause mortality and secondary outcomes included repeat surgical evacuation (for surgical cohort) and need for surgical evacuation (for non-surgical cohort) at 6-months. In the matched surgical cohort (n = 326), early MMAE was associated with a lower, but not statistically significant, rate of mortality compared to delayed MMAE (6.1 % vs. 11.0 %; OR, 0.527; 95 % CI, 0.235-1.178; P = 0.114). Similar rates were observed for repeat surgery for both groups. In the matched non-surgical cohort (n = 450), early MMAE was not associated with significant differences in mortality or need for surgery. Among patients with cSDH, early MMAE was associated with numerically lower rates of mortality in the surgical cohort. These findings support further investigation of early MMAE as a potential strategy to improve outcomes in surgical cSDH cases."
0000-0002-2450-4014,https://profiles.hopkinsmedicine.org/provider/vivek-yedavalli/2709369,2025,Onyx dilution reduces time to resolution of chronic subdural hematomas after middle meningeal artery embolization,"Hung Alice, Yang Wuyang, Das Oishika, Wang Xihang, Ran Kathleen, Ejimogu Emeka, Abdulrahim Mostafa, Nakamura Ryan, Hui Ferdinand, Yedavalli Vivek, Jackson Christopher M, Huang Judy, Tamargo Rafael J, Caplan Justin M, Gonzalez L Fernando, Xu Risheng",https://pubmed.ncbi.nlm.nih.gov/39516006/,"The benefit of distal embolite penetration for middle meningeal artery (MMA) embolization in chronic subdural hematomas (cSDH) remains controversial. To compare the use of diluted Onyx with undiluted Onyx in the management of cSDH. This is a retrospective study of patients with cSDH who underwent MMA embolization using Onyx 18 at our institution. The study population was divided into two subgroups based on whether the Onyx used was diluted or not. Baseline characteristics and technical aspects were compared. Primary outcome was cSDH resolution at follow-up. Secondary outcomes included time to resolution and duration of procedure. Univariate statistical analysis was performed. Of the 111 MMA embolizations performed at our institution, 99 were performed using Onyx 18 only. Within this cohort, 53 (53.5%) cases used standard Onyx and 46 (46.5%) cases used diluted Onyx. The diluted Onyx group had significantly greater volume of embolic agent used measured radiographically (P<0.001). There was no significant difference in duration of procedure. The percentage of cSDH resolution at last follow-up was similar between the two groups (P=0.98), but the time to resolution was significantly shorter in the diluted Onyx group (P=0.02). The use of diluted Onyx for MMA embolization is associated with greater embolization volume achieved under similar procedural times. While the percentage of patients who achieved cSDH resolution with diluted Onyx is similar to that for standard Onyx, the time to cSDH resolution is significantly shorter. Adoption of Onyx dilution can be considered in MMA embolization for cSDH."
0000-0002-2450-4014,https://profiles.hopkinsmedicine.org/provider/vivek-yedavalli/2709369,2025,Poor venous outflow is associated with hyperintense acute reperfusion marker on follow-up MRI in patients with acute ischemic stroke with a large vessel occlusion,"Zamarud Aroosa, Yuen Nicole, Wouters Anke, Mlynash Michael, Hugdal Stephen M, Seners Pierre, Kesten Jamie, Yedavalli Vivek, Faizy Tobias D, Albers Gregory W, Lansberg Maarten G, Heit Jeremy J",https://pubmed.ncbi.nlm.nih.gov/39393917/,"Hyperintense acute reperfusion marker (HARM) refers to delayed enhancement in the subarachnoid or subpial space on post-contrast fluid attenuated inversion recovery (FLAIR) images. HARM is a measure of blood-brain barrier breakdown, which has been correlated with poor outcomes in patients with acute ischemic stroke with large vessel occlusion (AIS-LVO). We hypothesized that unfavorable venous outflow (VO) would be correlated with HARM after thrombectomy treatment of AIS-LVO. To determine whether poor VO is associated with HARM on follow-up MRI after stroke in patients with AIS-LVO. Patients with AIS-LVO from the prospective CRISP2 and DEFUSE2 studies with a baseline CT angiography (CTA) scan and a follow-up MRI with FLAIR sequence were screened for enrollment. VO was measured on the baseline CTA scan using the cortical venous opacification score (COVES). HARM was determined on FLAIR sequences at the follow-up MRI. The primary outcome was the occurrence of HARM between those with good VO (VO+; COVES 3-6) and bad VO (VO-; COVES 0-2). 121 patients were included; 60.3% (n=73) had VO+ and 39.7% (n=48) had VO-. Patients with VO- had higher presentation National Institutes of Health Stroke Scale scores (18 (IQR 12-20) vs 12 (IQR 8-16) in VO+; P6 s volumes (105 (72-142) mL vs 66 (35-95) mL in VO+; P<0.001). VO- patients were more likely to develop HARM after thrombectomy (31% vs 10% in VO+; P=0.003). On multivariable regression analysis, VO- (OR=3.6 (95% CI 1.2 to 10.6); P=0.02) and the presence of any ICH (OR=3.6 (95% CI 1.2 to 10.5); P=0.02) were independently associated with the occurrence of HARM. In patients with AIS-LVO, VO- correlated with HARM on post-thrombectomy MRI."
0000-0002-2450-4014,https://profiles.hopkinsmedicine.org/provider/vivek-yedavalli/2709369,2025,Oxygen Extraction Fraction on Baseline MRI Predicts Infarction Growth in Successfully Reperfused Patients,"Asghariahmadabad Mona, Ismail Ameera, Metanat Pouya, Tavakkol Elham, Bahr-Hosseini Mersedeh, Szeder Viktor, Colby Geoffrey P, Saver Jeffrey L, Yedavalli Vivek S, Smith Wade S, Ko Nerissa, Kim Anthony S, Halabi Cathra, Savastano Luis E, Saloner David, Cooke Daniel L, Hetts Steven W, Amans Matthew R, Narsinh Kazim H, Josephson S Andrew, Hess Christopher P, Liebeskind David S, Nael Kambiz",https://pubmed.ncbi.nlm.nih.gov/40755297/,"In patients with acute ischemic stroke, infarct growth occurs despite successful reperfusion. Oxygen extraction fraction (OEF) has shown promising results in evaluating ischemic tissue viability and can now be quantified from routinely performed dynamic susceptibility contrast perfusion. We aimed to determine the association of OEF alterations within the ischemic tissue on pretreatment magnetic resonance imaging and infarct growth in patients who underwent successful reperfusion. In this retrospective cohort study from the University of California, Los Angeles, between 2015 and 2020, patients were included if they had anterior circulation large vessel occlusion, achieved successful reperfusion (Thrombolysis in Cerebral Infarction ≥2b), had pretreatment dynamic susceptibility contrast perfusion and posttreatment magnetic resonance imaging within 48 hours from reperfusion. Dynamic susceptibility contrast-derived OEF values were quantified from the segmented ischemic core (apparent diffusion coefficient ≤620×10 Among 89 patients who met inclusion criteria, 33 (37%) patients had infarct growth ≥10 mL. Patients with infarct growth had significantly ( Our results showed penumbra-OEF"
0000-0002-2450-4014,https://profiles.hopkinsmedicine.org/provider/vivek-yedavalli/2709369,2025,Impact of anxiety and mood disorders on elective flow diversion for unruptured intracranial aneurysms: propensity score-matched analyses of two large databases,"Chen Huanwen, Lakhani Dhairya A, Khunte Mihir, McIntyre Matthew K, Montemitro Chiara, Dmytriw Adam A, Wen Sijin, Yedavalli Vivek, Essibayi Muhammed Amir, Salim Hamza Adel, Altschul David, Malhotra Ajay, Colasurdo Marco, Gandhi Dheeraj",https://pubmed.ncbi.nlm.nih.gov/40953909/,"Anxiety and mood disorders (AMD) may impact the management and outcomes of patients with unruptured intracranial aneurysms (UIAs). This study investigates AMD's associations with utilization and outcomes of endovascular flow diversion (FD). This was a retrospective analysis of two databases - TriNetX and Nationwide Readmissions Database (NRD, 2020-2022). Patients with newly diagnosed UIA (Cohort 1, TriNetX) and those who underwent elective FD (Cohort 2, NRD) were identified and grouped into AMD and non-AMD controls; 1-to-1 propensity score matching (PSM) was performed to balance groups based on demographics and comorbidities. FD treatment rates within 5 years of UIA diagnosis (Cohort 1) and post-procedure outcomes of elective FD treatments (Cohort 2), including morbidity/mortality (discharge to rehabilitation/death) and stroke, were compared between AMD vs PSM controls. Our search identified 207 198 patients with newly diagnosed UIA (Cohort 1) and 14 220 who underwent elective FD (Cohort 2); ~30% of patients had AMD in both cohorts. In Cohort 1, patients with AMD with newly diagnosed UIA (n=47 381) had significantly higher rates of FD treatment compared with PSM controls (1.9% vs 1.5%, hazard ratio (HR) 1.23 (95% confidence interval (CI) 1.10 to 1.37) p<0.001). In Cohort 2, patients with AMD who underwent elective FD (n=3832) exhibited higher rates of perioperative morbidity/mortality (8.0% vs 4.8%; odds ratio (OR) 1.73 (95% CI 1.23 to 2.44), p=0.002), post-discharge morbidity/mortality (HR 1.63 (95% CI 1.11 to 2.40), p=0.012), perioperative stroke (6.7% vs 4.7%; OR 1.44 (95% CI 1.06 to 1.95), p=0.021), and post-discharge stroke (HR 1.82 (95% CI 1.05 to 3.17), p=0.034) compared with PSM controls. Among UIA patients, AMD is associated with increased FD utilization and worse clinical outcomes following FD."
0000-0002-2450-4014,https://profiles.hopkinsmedicine.org/provider/vivek-yedavalli/2709369,2025,Automated Vessel Occlusion Software in Acute Ischemic Stroke: Pearls and Pitfalls,"Aziz Yasmin N, Sriwastwa Aakanksha, Nael Kambiz, Harker Pablo, Mistry Eva A, Khatri Pooja, Chatterjee Arindam R, Heit Jeremy J, Jadhav Ashutosh, Yedavalli Vivek, Vagal Achala S",https://pubmed.ncbi.nlm.nih.gov/40485432/,"Software programs leveraging artificial intelligence to detect vessel occlusions are now widely available to aid in stroke triage. Given their proprietary use, there is a surprising lack of information regarding how the software works, who is using the software, and their performance in an unbiased real-world setting. In this educational review of automated vessel occlusion software, we discuss emerging evidence of their utility, underlying algorithms, real-world diagnostic performance, and limitations. The intended audience includes specialists in stroke care in neurology, emergency medicine, radiology, and neurosurgery. Practical tips for onboarding and utilization of this technology are provided based on the multidisciplinary experience of the authorship team."
0000-0002-2450-4014,https://profiles.hopkinsmedicine.org/provider/vivek-yedavalli/2709369,2025,"Coexistent Developmental Venous Anomaly, Venous Varix, and Hematoma","Villafuerte-Trisolini Brian, Yedavalli Vivek, Ghostine Jimmy, Crimmins Michael, Santillan Alejandro",https://pubmed.ncbi.nlm.nih.gov/40854042/,Abstract unavailable.
0000-0002-2450-4014,https://profiles.hopkinsmedicine.org/provider/vivek-yedavalli/2709369,2025,Functional Imaging in Alzheimer's Disease: A Systematic Review and Meta‐Analysis of ASL‐MRI and FDG‐PET,"Radmard Mahla, Gad Mona, Sheikhy Ali, Dagher Richard, Yedavalli Vivek, Luna Licia P",https://pubmed.ncbi.nlm.nih.gov/40898829/,"Alzheimer's disease (AD) and mild cognitive impairment (MCI) are two common conditions associated with cognitive decline. With global dementia cases rising, identifying the most accurate imaging method for diagnosis is essential. Following Preferred Reporting Items for Systematic review and Meta-Analysis Protocols, we systematically reviewed studies utilizing arterial spin labeling magnetic resonance imaging (ASL-MRI) and [18F]-2-fluoro-2-deoxy-D-glucose positron emission tomography (FDG-PET) for neurodegenerative disorders. Searches in PubMed/MEDLINE, Scopus, and Embase led to 17 studies directly comparing these modalities for MCI/AD diagnosis. Seven studies met criteria for meta-analysis based on interreader agreement and area under the curve (AUC) data. Meta-analysis was performed using the R ""Mada"" package, with study heterogeneity assessed via the Zhou and Dendukuri approach. Meta-analysis of seven studies showed FDG-PET had a slightly higher AUC (0.864, sensitivity 0.81, specificity 0.80) compared to ASL-MRI (AUC 0.836, sensitivity 0.73, specificity 0.80), but no statistically significant difference. Low heterogeneity was observed (I FDG-PET and ASL-MRI demonstrate comparable diagnostic accuracy for AD and MCI. Selection between modalities may depend on availability, cost, and safety considerations. Both FDG-PET and MRI-ASL are effective at identifying MCI and AD, enabling accurate diagnosis. The choice of which modality to use may be addressed by cost, availability, and consideration of other potential diagnoses."
0000-0002-2450-4014,https://profiles.hopkinsmedicine.org/provider/vivek-yedavalli/2709369,2025,The Large Core Paradox,"Ter Schiphorst Adrien, Seners Pierre, Arquizan Caroline, Yedavalli Vivek, Olivot Jean-Marc, Lansberg Maarten G, Muir Keith W, Parsons Mark W, Saver Jeffrey L, Fisher Marc, Albers Gregory W, Costalat Vincent, Baron Jean-Claude",https://pubmed.ncbi.nlm.nih.gov/40567239/,"Recently, 6 randomized controlled trials of endovascular treatment (EVT) versus medical management in anterior circulation large vessel occlusion with large-core documented significant benefit of EVT on functional outcome. Moreover, one trial reported the benefit of EVT in the very large-core category (Alberta Stroke Program Early CT Score, 0-2). These results are considered paradoxical by some as they contradict the prevailing view that the presence of a large core precludes the possibility of good outcomes following reperfusion. They, in turn, led some investigators to question the applicability of the core/penumbra model in the case of large-core stroke and even its overall validity, specifically regarding the notion that the core reliably predicts tissue infarction. Here, we discuss the trial results and propose alternative explanations for the large-core paradox. First, although EVT does improve outcomes as compared with medical management, overall outcomes remain poor in ≈80% of the treated population. Second, the assessment of core extent on imaging, particularly with computed tomography, is potentially inaccurate, especially in the early time window. Third, consistent with observational studies, some randomized controlled trial substudies suggest that the benefit of EVT in this population derives at least in part from the salvage of penumbra, which appears to have been present in a large percentage of enrolled patients. Fourth, the markedly reduced perfusion that prevails within large cores facilitates the early development of vasogenic edema. This heterogeneity of tissue injury may, in turn, lead to an overestimation of true core/neuronal death as estimated with computed tomography and magnetic resonance imaging. Assessing patients with apparent large core should consider these notions when discussing eligibility for EVT. Early reperfusion of large-core patients is expected to both target any residual penumbra and prevent the development of vasogenic edema within the severely hypoperfused areas. These considerations underscore the need for more reliable methods to identify irreversible neuronal injury inside the imaging-based estimated core."
0000-0002-2450-4014,https://profiles.hopkinsmedicine.org/provider/vivek-yedavalli/2709369,2025,Liquid embolic penetration of the skull during middle meningeal artery embolization is correlated with chronic subdural hematoma resolution,"Das Oishika, Hung Alice, Wang Xihang, Feghali James, Yang Wuyang, Yedavalli Vivek, Jackson Christopher M, Huang Judy, Tamargo Rafael J, Caplan Justin M, Gonzalez L Fernando, Xu Risheng",https://pubmed.ncbi.nlm.nih.gov/40866206/,"Few studies have explored the role of skull-meninges interaction in outcomes post middle meningeal artery (MMA) embolization. We investigated how the liquid embolic penetration into the skull bone during MMA embolization affects chronic subdural hematoma (cSDH) resolution. All patients undergoing MMA embolization at our institution from January 2019 to November 2024 were included in this single center retrospective study. Bilateral embolizations were counted as two separate cases. The cohort was divided into two groups: those with embolic agent within skull bone, and those without. Baseline characteristics, procedural details, and SDH resolution status were compared. Univariate analysis was performed. A total of 132 MMA embolization cases were included within this cohort; 49 (37.1%) had liquid embolic agent within the skull bone, and 83 (62.9%) did not. The presence of liquid embolic agent within the skull bone was significantly correlated with higher rates of resolution for cSDH (P=0.005). The cohort with embolic material within bone was also associated with increased diffuse distal penetration (P<0.001) and increased volume of embolic agent (P60 days of follow-up, bony embolic penetration remained significantly associated with cSDH resolution (P=0.038). Penetration of liquid embolic agent into the skull during MMA embolization is associated with higher rates of cSDH resolution. Further studies exploring the potential role of skull bone marrow in the inflammatory process involved in cSDH formation are warranted."
